title,url,channel_name,thumbnail_url,description
Redneck vs Fancy Whiskey Glass,https://www.youtube.com/watch?v=2jfbXZiE6Lc,Drew Talbert,https://i.ytimg.com/vi/2jfbXZiE6Lc/hqdefault.jpg?sqp=-oaymwEcCPYBEIoBSFXyq4qpAw4IARUAAIhCGAFwAcABBg==&rs=AOn4CLA7SJIX7Y0LFpd5Ya6QC2EwRGkMZw,I’m just shocked Brad was able to sell him in that $20 hooch Co-write w/ Andrea Kelley
World’s Sharpest Knife!,https://www.youtube.com/watch?v=ySXPnjStay4,Beast Reacts,https://i.ytimg.com/vi/ySXPnjStay4/hqdefault.jpg?sqp=-oaymwEcCPYBEIoBSFXyq4qpAw4IARUAAIhCGAFwAcABBg==&rs=AOn4CLB2KGtDwtWnTDxGlDpjzSpTPlHN5Q,Chris and I react to the greatest item hacks in the world! CHECK OUT THESE CHANNELS OR ELSE Experimental Fun https://www.youtube.com/watch?v=5ZchgU9KLOc Louis Weisz https://www.youtube.com/watc...
Imagine vaping 🤡 😂,https://www.youtube.com/watch?v=5Gfea7nHKO0,ecomedyethann,https://i.ytimg.com/vi/5Gfea7nHKO0/hqdefault.jpg?sqp=-oaymwEcCPYBEIoBSFXyq4qpAw4IARUAAIhCGAFwAcABBg==&rs=AOn4CLA9dsT3RLhkCaOrA-PlqInL3cddjQ,#explore #viral #tiktok
dhruv - double take (Official Video),https://www.youtube.com/watch?v=R8FHtIhWqNo,dhruv,https://i.ytimg.com/vi/R8FHtIhWqNo/hqdefault.jpg?sqp=-oaymwEcCPYBEIoBSFXyq4qpAw4IARUAAIhCGAFwAcABBg==&rs=AOn4CLDZPyVwRPrgjVk5OkbFUBJ2ZaD0og,Follow dhruv: Instagram: https://www.instagram.com/dhrvie/ Facebook: https://www.facebook.com/dhrvie/ Twitter: https://twitter.com/dhrvie Directed by: Aboveground Produced by: Samuel Taylor...
FIGHT HIGHLIGHTS | Teófimo López vs. George Kambosos Jr.,https://www.youtube.com/watch?v=0avqY81npVU,DAZN Boxing,,"Highlights of Teófimo López vs. George Kambosos Jr. from the Hulu Theater at Madison Square Garden in New York City, New York. Subscribe to our YouTube channel 👉 http://bit.ly/DAZNBoxingYouT..."
LEO MESSI WINS 7TH BALLON D'OR (BALLON D'OR 2021) 7️⃣ 🏆,https://www.youtube.com/watch?v=ETHUhf058N8,FC Barcelona,,"Leo Messi has won yet another Ballon d’Or. After a year in which France Football did not name a winner due to Covid-19, the Argentinian has been revealed as the world player of the year for..."
Shaquille O'Neal Goes Sneaker Shopping With Complex,https://www.youtube.com/watch?v=VfOtgxp4Fng,Complex,,"Shaquille O’Neal goes Sneaker Shopping with Complex’s Joe La Puma at A Ma Maniere in Atlanta and talks about signing to Reebok, starting his own sneaker brand, and the problems he’s dealt..."
Nardo Wick - Me or Sum (feat. Future & Lil Baby) [Official Audio],https://www.youtube.com/watch?v=olKxFg0j-Ow,Nardo Wick,,Nardo Wick - Me or Sum (feat. Future & Lil Baby) [Official Audio] Stream/Download: https://NardoWick.lnk.to/MeOrSumID Who Is Nardo Wick - Out 12.3: http://whoisnardowick.com Subscribe: https://N...
How Letters Get Named: “W”,https://www.youtube.com/watch?v=lVEgEm-VqXE,Loic Suberville,,
I Am Old Now..,https://www.youtube.com/watch?v=AmCggyfL6kI,DanTDM,,sub pls : http://bit.ly/TxtGm8 Follow Me : 🐦 http://www.twitter.com/DanTDM 📷 http://www.instagram.com/DanTDM In This Video: 00:00 - The Memes Begin 00:15 - WHAT DID YOU DO?! 01:22 -...
Ashanti Proves Why She's The Lady Of Soul With A Medley Of Her Greatest Hits | Soul Train Awards '21,https://www.youtube.com/watch?v=mqDuiqThMZI,BETNetworks,,"The 2021 Lady of Soul, Ashanti shut down the Soul Train Awards stage with performances of her greatest hits including ""Baby,"" ""Happy,"" ""Always On Time,"" ""The Way That I Love You,"" and so many..."
OUR HOUSE STORY...,https://www.youtube.com/watch?v=Ud5xlPGK09w,The ACE Family,,OUR HOUSE STORY... **ACE FAMILY MERCH HERE: shopacefamily.com LAST VIDEO: https://www.youtube.com/watch?v=STpi_bjI9v4 JOIN THE ACE FAMILY & SUBSCRIBE: http://bit.ly/THEACEFAMILY *TURN...
Message | The Book of Boba Fett | Disney+,https://www.youtube.com/watch?v=XCAlNWNbN5c,Star Wars,,"“The Book of Boba Fett,” a thrilling Star Wars adventure teased in a surprise end-credit sequence following the Season 2 finale of “The Mandalorian,” finds legendary bounty hunter Boba..."
KAI 카이 'Peaches' MV,https://www.youtube.com/watch?v=GUdnTGnm6Yk,SMTOWN,,"KAI's 2nd mini album ""Peaches"" is out! Listen and download on your favorite platform: https://smarturl.it/KAI_Peaches [Tracklist] 01 Peaches 02 Vanilla 03 Domino 04 Come In 05 To Be Honest..."
Saint Etienne vs PSG | LIGUE 1 HIGHLIGHTS | 11/28/2021 | beIN SPORTS USA,https://www.youtube.com/watch?v=Zf17TtLeh5o,beIN SPORTS USA,,Though Saint Etienne gave PSG a hard battle through most of the game Messi and company gave the greens a final score to keep the Parisians up top the Ligue 1 table. Catch the latest highlights...
Things My Students Do That I Just Don’t Get pt. 24 #shorts,https://www.youtube.com/watch?v=jgC06N-fE5E,Mrs. Woolley in 5th,,"Thank you so much for watching! 🐭💜 Don’t forget to like, comment, and subscribe so you don’t miss out of future videos! Become a member of the Woolley fam! 🐭MERCH: https://teespri..."
I Spent 100 Days in a Frozen Zombie Apocalypse in Minecraft... Part 2,https://www.youtube.com/watch?v=eRsSq78WUYk,Forge Labs,,"I Spent 100 Days in a Zombie Apocalypse in Minecraft. Download and play The Battle Cats for free! Black Friday events are on now, including free log in bonus rewards, special discounts and..."
JAY - END OF DISCUSSION (Official Music Video) -RichBoyTroy DISS,https://www.youtube.com/watch?v=JINaP4N5Xp8,Imbadkidjay,,JAY - END OF DISCUSSION (Official Music Video) -RichBoyTroy DISS More Videos ➔ https://www.youtube.com/channel/UCPmQ... -------------------------------------------------------------------------...
"Stray Kids ""Christmas EveL"" M/V",https://www.youtube.com/watch?v=57n4dZAPxNY,JYP Entertainment,,"Stray Kids(스트레이 키즈) ""Christmas EveL"" M/V Stray Kids Holiday Special Single ""Christmas EveL"" iTunes & Apple Music: apple.co/3cWnnqj Spotify: http://spoti.fi/3Gcrvz5 Stray Kids..."
CHARLES BARKLEY GAINED 20-LBS IN 2 DAYS BEFORE THE NBA DRAFT | #shorts,https://www.youtube.com/watch?v=h91PyXBesgk,CHED,,Charles Barkley gained 20 lbs in two days to avoid getting drafted by the Philadelphia 76ers… LIKE & SUBSCRIBE 👍 #NBA #CharlesBarkley #Philadelphia76ers Music By Prod. Depo - Song:...
Tubbo Takes On America!,https://www.youtube.com/watch?v=Als2oXt4oEw,Tubbo,,This video is about my first time visiting America! it has all of my travels and friends! plz like cus that would be king of you my good people! Editor: @LlamaNeck My Second Channel: https://www...
Can I Use The Customers Water When Pressure Washing?,https://www.youtube.com/watch?v=j66p1e8MyZk,Forever Self Employed,,
Most People Don't Know How Bikes Work,https://www.youtube.com/watch?v=9cNmUNHSBac,Veritasium,,"Why are bicycles stable? The most common answer is gyroscopic effects, but this is not right. This video was sponsored by Kiwico. Get 50% off your first month of any crate at https://kiwico.com/ver..."
Thoughts on No Nut November?👀 - Larry Wheels,https://www.youtube.com/watch?v=p8xl0HIEaVQ,Noel Deyzel,,"@Larry Wheels RYSE Supplements (Use code ""NOEL"" for 15% off your purchase) My current stack: (restocked) Pre-workout: https://rysesupps.com/products/project-blackout-pre-workout Best tasting..."
GTA Wanted Level 100!,https://www.youtube.com/watch?v=L678M0y86dw,MrBeast Gaming,,"Thanks to Displate for sponsoring this video! Get 34% off 1-2 Displates, 38% off 3-4 Displates and 42% off your order of 5+ Displates for Black Friday here - valid through 12/10 https://displate.co..."
Seeing my mom for the first time in two years,https://www.youtube.com/watch?v=_XxqEHg4s2g,Simone Giertz,,I turn an Avion Sportsman trailer/camper into a guest house for my mom. Thanks KiwiCo for sponsoring this video. Check out the perfect holiday gifts for the kiddos in your life and get your...
BTS (방탄소년단) PERMISSION TO DANCE ON STAGE - LA Highlights,https://www.youtube.com/watch?v=qFDTm_TBAcg,BANGTANTV,,BTS PERMISSION TO DANCE ON STAGE - LA 📝 About Online Live-Streaming Ticket: https://weverse.onelink.me/qt3S/1d6a579b 🎫 To Purchase: https://weverseshop.onelink.me/BZSY/58472765 📝...
Bruno Mars & Anderson .Paak as Silk Sonic - Fly As Me (LIVE BET Soul Train Awards 2021),https://www.youtube.com/watch?v=IQQ-87RSCRM,Bruno Mars,,"Bruno Mars, Anderson .Paak, Silk Sonic - Fly As Me - Live from the BET Soul Train Awards 2021 ‘An Evening with Silk Sonic’ available now: https://SilkSonic.lnk.to/AEWSSID 🔔 Subscribe..."
Sea of Thieves Season Five: Official Content Update Video,https://www.youtube.com/watch?v=mwxAblfDrMQ,Sea of Thieves,,Grab a grog and don your best party finery – Sea of Thieves Season Five’s boatload of Voyage-enhancing features arrives December 2nd! Bury loot for safety or share your treasure maps with...
Dream Escaped...,https://www.youtube.com/watch?v=G7H3KRfIkCY,SapnapLIVE,,Dream Escaped... After months of locked up Dream has finally escaped prison on the Dream SMP Follow my socials: ➽ Twitter - @sapnap ➽ Twitch - @sapnap ➽ Instagram - @sapnapinsta Merch:...
SECRET Behind Starbucks Drink Sizes (marketing),https://www.youtube.com/watch?v=OLrlV5xzWQU,Max Klymenko,,#shorts #starbucks #marketing #business
AS SAINT-ÉTIENNE - PARIS SAINT-GERMAIN (1 - 3) - Highlights - (ASSE - PSG) / 2021-2022,https://www.youtube.com/watch?v=UYPC92TWNws,Ligue 1 Uber Eats Official,,AS SAINT-ÉTIENNE vs PARIS SAINT-GERMAIN Highlights (1 - 3) in video. Ligue 1 Uber Eats - Season 2021/2022 - Week 15 STADE GEOFFROY GUICHARD - Sunday 28 November 2021 Goals : Denis BOUANGA...
Chelsea v. Manchester United | PREMIER LEAGUE HIGHLIGHTS | 11/28/2021 | NBC Sports,https://www.youtube.com/watch?v=GqUUIWb22ss,NBC Sports,,Jorginho played scapegoat and savior for Chelsea as he played a key role in both goals in the Blues' 1-1 draw against manager-less Manchester United. #NBCSports #PremierLeague #Chelsea #ManUnited...
Halo Infinite | Carry On,https://www.youtube.com/watch?v=aUD1IxXhfHQ,HALO,,"Dive into the fray with Halo's most harrowing fight yet. You face an entire army of ruthless Banished soldiers. But they face the Master Chief. For more information on Halo Infinite, head..."
I Made $1 Billion in 5 Seconds and It Changed Reality - Hydroneer,https://www.youtube.com/watch?v=if_2PTZKsEo,Let's Game It Out,,Opera GX gives you complete CONTROL over your RAM & CPU usage. Kill CPU-draining tabs! Download now for FREE: https://operagx.gg/LetsGameItOut2 Thanks to Opera for sponsoring! JOIN MY STREAMS!...
Kurstin x Grohl: The Hanukkah Sessions 2021: Night One,https://www.youtube.com/watch?v=AB8Jxjv5mug,Foo Fighters,,"Welcome back to the menorah, y’all. Let’s kick it this year’s Hanukkah sessions with one of Dallas, Texas’s favorite Jewish daughters. So put on your coffee shop spectacles and your..."
Why Phineas and Ferb Brigade Shouldn’t Work,https://www.youtube.com/watch?v=4O7LmEwV08g,Dan Povenmire,,
Jeff Bezos vs Mansa Musa. Epic Rap Battles Of History,https://www.youtube.com/watch?v=fCeUvPL9rMc,ERB,,Jeff Bezos vs Mansa Musa. Epic Rap Battles Of History. Huge thank you to NordVPN for sponsoring this battle! Go to https://NordVPN.com/EPIC to get a 2-year plan with a huge epic discount!...
Jokes on jokes on jokes,https://www.youtube.com/watch?v=7RIO-Aqb7_w,SomeThingElseYT,,"I have a journal I carry around and write in whenever I have a thought, joke, or really pretty much anything that comes to mind. Wanted to share some of them New Merch Available link in comments!..."
Everything GREAT About The Matrix! (Part 2),https://www.youtube.com/watch?v=Jt2ldf5ecUU,CinemaWins,,Sign up for CuriosityStream and watch my extra conclusion thoughts on Nebula http://curiositystream.com/cinemawins EGA The Matrix! (Part 1): https://youtu.be/hl-pFXc5Zz4 Part 2 of EGA Matrix...
1 Minute ASMR with ASMRtist Friends,https://www.youtube.com/watch?v=y3Lv8eWwCpg,fastASMR,,"Today’s your big day and you’re kind of nervous, but don’t worry, we’ve got you, we’re the best, fastest and most relaxing team of professionals to get you ready in no time, quite..."
Why the US government is always shutting down,https://www.youtube.com/watch?v=Kdv07eIC8Wg,Vox,,How the US can shut down but other countries can’t Subscribe and turn on notifications 🔔 so you don't miss any videos: http://goo.gl/0bsAjO Towards the end of every year the countdown...
Sad girlz luv money - Enola Bedard & Augusto,https://www.youtube.com/watch?v=fXk49CoALm4,Enola Bedard,,
The Rare Engine that Kills Everything it Touches,https://www.youtube.com/watch?v=-3HBAvkc4a0,FortNine,,Only one internal combustion design from the 20th century has gone into production: the Wankel Rotary. Yet every motorcycle manufacturer who tries it goes bankrupt. What’s the curse? Support...
Make your own SHINY Pokemon in Brilliant Diamond Shining Pearl,https://www.youtube.com/watch?v=YEfKTOUf87o,BLAINES,,❱ Never miss a video! Subscribe & Bells ON🔔 https://bit.ly/3galjxh Thanks to WackoJacko on Discord for linking me to info on this ⚡Follow my Socials⚡ ❱ Discord for trades and giveaways...
Fired?,https://www.youtube.com/watch?v=AV1gnTSOsNk,Dani Razooqi,,
"I Jumped 59,100 Blocks High in Minecraft Survival. (No Mods)",https://www.youtube.com/watch?v=e5y3AIl43ZM,IGoByLotsOfNames,,"Minecraft is very exploitable. This is shown in this ""experiment"" where I farmed 1 thousand end crystals to basically reach low orbit in a single jump. Music List: https://pastebin.com/YzPvspAF"
SEC Shorts - Auburn and Texas A&M show up early to claim their wins,https://www.youtube.com/watch?v=esYZ15aIccU,SEC Shorts,,"Auburn and Texas A&M get a head start on post game traffic and head to the Wins Claim Department in order to claim their W's for this week. Just one tiny problem, the clock hasn't struck zero..."
Rams vs. Packers Week 12 Highlights | NFL 2021,https://www.youtube.com/watch?v=mdfmRpAfK4s,NFL,,The Los Angeles Rams take on the Green Bay Packers during Week 12 of the 2021 NFL season. Subscribe to NFL: http://j.mp/1L0bVBu Check out our other channels: Para más contenido de la NFL...
LIVING IN A BUBBLE HOUSE,https://www.youtube.com/watch?v=CxMCu0py-RY,Lexi Hensler,,#cider #ciderhaul #shopcider Shop Cider!! http://hicider.com/LexiHensler 15% off code: lexihensler_yt CIDER ITEMS - 02:18 Button Up Knitted Cardigan https://shop.shopcider.com/products/butto...
24 Hours in AKITA | 4 Things to do in Japan's CHICKEN Capital,https://www.youtube.com/watch?v=NOzd7vFfP0k,Abroad in Japan,,"Akita is home to Japan's most luxurious chicken called Hinai Jidori. We go in search of the juiciest chicken, the cutest Akita dogs and the scariest monsters in Japan on our road trip across..."
"$456,000 Squid Game In Real Life!",https://www.youtube.com/watch?v=0e3GPea1Tyg,MrBeast,,MAKE SURE YOU WATCH UNTIL GLASS BRIDGE IT'S INSANE! Download Brawl Stars now and get a free gift from me in the game! http://supr.cl/mrbeast Thank you GoPro for supplying us with cameras...
GTA Wanted Level 100!,https://www.youtube.com/watch?v=L678M0y86dw,MrBeast Gaming,,"Thanks to Displate for sponsoring this video! Get 34% off 1-2 Displates, 38% off 3-4 Displates and 42% off your order of 5+ Displates for Black Friday here - valid through 12/10 https://displate.co..."
Using Reverse Psychology To Get ANYTHING You Want,https://www.youtube.com/watch?v=HHbF8HaC4w8,Amyy Woahh,,
Never Spill a Drink again. 🤯,https://www.youtube.com/watch?v=jTihJ0RFjFc,Mrwhosetheboss Shorts,,Full gadgets video HERE: https://youtu.be/GCmiKaLnd7M Do consider subscribing to my Shorts Channel! 👊 Main Mrwhosetheboss YouTube Channel: https://www.youtube.com/user/Mrwhosetheboss #shorts...
When you need that lowdown truth,https://www.youtube.com/watch?v=sRR3EUDJ23c,Drew Talbert,,
GENIUS PEOPLE WHO BEAT THE SYSTEM!! #Shorts,https://www.youtube.com/watch?v=Hs3b4-vnWAk,Davidjustinn,,
I Made $1 Billion in 5 Seconds and It Changed Reality - Hydroneer,https://www.youtube.com/watch?v=if_2PTZKsEo,Let's Game It Out,,Opera GX gives you complete CONTROL over your RAM & CPU usage. Kill CPU-draining tabs! Download now for FREE: https://operagx.gg/LetsGameItOut2 Thanks to Opera for sponsoring! JOIN MY STREAMS!...
Saint Etienne vs PSG | LIGUE 1 HIGHLIGHTS | 11/28/2021 | beIN SPORTS USA,https://www.youtube.com/watch?v=Zf17TtLeh5o,beIN SPORTS USA,,Though Saint Etienne gave PSG a hard battle through most of the game Messi and company gave the greens a final score to keep the Parisians up top the Ligue 1 table. Catch the latest highlights...
Alaska Bucket List,https://www.youtube.com/watch?v=hj5Xv2L2X4M,Dude Perfect,,"Dog Sledding, Ice Climbing, White Water Rafting, Salmon Fishing, and more.. Alaska is INCREDIBLE! Thanks to our friends at Bass Pro Shops for sponsoring this video! Visit Bass Pro Shops and..."
SPIDER-MAN: NO WAY HOME - Official Trailer (HD),https://www.youtube.com/watch?v=JfVOs4VSpmA,Sony Pictures Entertainment,,"We started getting visitors… from every universe. Watch the official trailer for #SpiderManNoWayHome, exclusively in movie theaters December 17. Tickets on sale C̶y̶b̶e̶r̶ Spider-Monday,..."
How Letters Get Named: “W”,https://www.youtube.com/watch?v=lVEgEm-VqXE,Loic Suberville,,
Moneybagg Yo - Scorpio [Official Music Video],https://www.youtube.com/watch?v=GChxzIwyNt4,MoneyBagg Yo,,Moneybagg Yo's new album out now: https://moneybaggyo.lnk.to/AGangstasPainReloaded Follow Moneybagg Yo: https://www.instagram.com/moneybaggyo/ https://twitter.com/moneybaggyo https://www.facebook....
World’s Sharpest Knife!,https://www.youtube.com/watch?v=ySXPnjStay4,Beast Reacts,,Chris and I react to the greatest item hacks in the world! CHECK OUT THESE CHANNELS OR ELSE Experimental Fun https://www.youtube.com/watch?v=5ZchgU9KLOc Louis Weisz https://www.youtube.com/watc...
"Game Theory: FNAF, Goodbye Father (FNAF Security Breach Predictions)",https://www.youtube.com/watch?v=kbAuywE8xPo,The Game Theorists,,Special thanks to Displate for sponsoring this video! Enjoy big savings on your prints for a LIMITED TIME! ► https://displate.com/promo/gametheorists?art=6180340794652 Get 34% off 1-2...
Rod Wave - By Your Side (Official Video),https://www.youtube.com/watch?v=y7394ESN91Y,RodWave,,#RodWave #SoulFly #ByYourSide Stream SoulFly: http://smarturl.it/SoulFlyDeluxe Follow Rod Wave: ► Instagram: https://www.instagram.com/rodwave/?hl=en ► Twitter: https://twitter.com/rodwave...
95th annual Macy’s Thanksgiving Day Parade takes place in New York | USA Today,https://www.youtube.com/watch?v=0F3d6e8B3bM,USA TODAY,,"The classic Macy's Thanksgiving Day Parade has been watched by millions of New York residents and millions more on television. Broadway will be showcased with performances from musicals “Six,..."
Taylor Swift - All Too Well: The Short Film,https://www.youtube.com/watch?v=tollGa3S0o8,Taylor Swift,,"Written & Directed by: Taylor Swift Starring: Sadie Sink, Dylan O’Brien & Taylor Swift Red (Taylor’s Version) available everywhere now: https://taylor.lnk.to/redtaylorsversion ►Subscribe..."
Imagine vaping 🤡 😂,https://www.youtube.com/watch?v=5Gfea7nHKO0,ecomedyethann,,#explore #viral #tiktok
Jeff Bezos vs Mansa Musa. Epic Rap Battles Of History,https://www.youtube.com/watch?v=fCeUvPL9rMc,ERB,,Jeff Bezos vs Mansa Musa. Epic Rap Battles Of History. Huge thank you to NordVPN for sponsoring this battle! Go to https://NordVPN.com/EPIC to get a 2-year plan with a huge epic discount!...
"POV everyone gets a mark on their arm when they lie, except for him…",https://www.youtube.com/watch?v=qAGUAXfdlOw,Ian Boggs,,Inspired by @NicoleRodgers on TikTok (https://www.tiktok.com/@nicolerodge?) // Follow me on IG for your daily dose of Ian! 🙌🏼 IG: https://www.instagram.com/ianboggz/ Hey Ian Nation!...
100 Days - [Old Minecraft],https://www.youtube.com/watch?v=hySgv7XyWaM,Luke TheNotable,,"Old Minecraft is quite a trip down memory lane and in this video, Luke TheNotable attempts to survive for 100 Days in Minecraft 1.0 in the notable hardcore mode. If he dies, his world is deleted...."
AMP THANKSGIVING REUNION,https://www.youtube.com/watch?v=E51vBBDAwM0,AMP,,Join this channel to get access to perks: https://www.youtube.com/channel/UCJbYdyufHR-cxOuY96KIoqA/join AMP AMP AMP AMP 💜 Join the AMP SQUAD on Discord: https://discord.gg/zMeuncfUc8 📸:...
Green Dry Aged Turkey #shorts,https://www.youtube.com/watch?v=-2exRhKYqRk,Max the Meat Guy,,"Dry Aged Thai Turkey ⚪️🔴🟢⚫️ I hope everyone had an amazing Thanksgiving and I appreciate the support from each of you! This is the last turkey video, it’s officially prime..."
how my claire’s piercing got infected…😐,https://www.youtube.com/watch?v=QCrCl3za2Qo,BENOFTHEWEEK,,oopsie
I Spent 100 Days in a Frozen Zombie Apocalypse in Minecraft... Part 2,https://www.youtube.com/watch?v=eRsSq78WUYk,Forge Labs,,"I Spent 100 Days in a Zombie Apocalypse in Minecraft. Download and play The Battle Cats for free! Black Friday events are on now, including free log in bonus rewards, special discounts and..."
"CM Punk & MJF: The Moment the World Has Been Waiting for Didn't Disappoint | AEW Dynamite, 11/24/21",https://www.youtube.com/watch?v=SPAAKVDDEUU,All Elite Wrestling,,#AEWDynamite #CMPunk #MJF Subscribe now and never miss a new video: https://www.youtube.com/c/aew?sub_confirmation=1 AEW Dynamite airs every Wednesday night 8e/7c on TNT **AEW DYNAMITE MOVES...
SECRET Behind Starbucks Drink Sizes (marketing),https://www.youtube.com/watch?v=OLrlV5xzWQU,Max Klymenko,,#shorts #starbucks #marketing #business
BTS & Papa Mochi Are Reunited!,https://www.youtube.com/watch?v=pRl2tawentY,The Late Late Show with James Corden,,"In this extended interview, James welcomes BTS back to the Late Late Show couch after not seeing each other in person for 2 years and RM cuts to the chase to clear the air with Papa Mochi...."
Fired?,https://www.youtube.com/watch?v=AV1gnTSOsNk,Dani Razooqi,,
Ashanti Proves Why She's The Lady Of Soul With A Medley Of Her Greatest Hits | Soul Train Awards '21,https://www.youtube.com/watch?v=mqDuiqThMZI,BETNetworks,,"The 2021 Lady of Soul, Ashanti shut down the Soul Train Awards stage with performances of her greatest hits including ""Baby,"" ""Happy,"" ""Always On Time,"" ""The Way That I Love You,"" and so many..."
Jackboy - Don't Force My Hand (Official Video),https://www.youtube.com/watch?v=5nsul6Kjo2E,1804 Jackboy,,"#Jackboy #DontForceMyHand #1804Records Stream ""Don't Force My Hand"" Now: https://music.empi.re/dontforcemyhand Official Video by Jackboy - Don't Force My Hand© 2021 1804 Records / EMPIRE"
When my Step Dad tries to tell me what to do:,https://www.youtube.com/watch?v=YMMN1Vn2crA,spicyycam_,,#short #shorts
WALMART WORKERS ARE SOMETHING ELSE 💀😭 #shorts,https://www.youtube.com/watch?v=_4mJn3hFdXo,Sharukh Sharukh,,
The Weeknd - Die For You (Official Music Video),https://www.youtube.com/watch?v=uPD0QOGTmMI,The Weeknd,,"Official music video for The Weeknd “Die For You”, from Starboy available everywhere now: http://theweeknd.co/Starboy ►Subscribe to The Weeknd on YouTube: http://theweeknd.co/subscribeYD..."
Iman Shumpert’s Freestyle – Dancing with the Stars,https://www.youtube.com/watch?v=ZzQWzYWjhmE,Dancing With The Stars,,Iman Shumpert and Daniella Karagach dance Freestyle to “Lose Control / Bounce” by Missy Elliott ft. Ciara & Fat Man Scoop / DJ Clent on the Dancing with the Stars Finale! Subscribe: http://goo...
Can you ESCAPE this Minecraft Prison??,https://www.youtube.com/watch?v=HkqG2kcsMW0,SeaWattgaming,,Can you escape this Minecraft Prison?? Download Monster Legends for free to claim special rewards before Dec 8th: https://monsterlegends.onelink.me/QSYm/MLNovember2 PLEASE JOIN MY DISCORD...
JAY - END OF DISCUSSION (Official Music Video) -RichBoyTroy DISS,https://www.youtube.com/watch?v=JINaP4N5Xp8,Imbadkidjay,,JAY - END OF DISCUSSION (Official Music Video) -RichBoyTroy DISS More Videos ➔ https://www.youtube.com/channel/UCPmQ... -------------------------------------------------------------------------...
Bruno Mars & Anderson .Paak as Silk Sonic - Smokin Out The Window (LIVE American Music Awards 2021),https://www.youtube.com/watch?v=nAUwKeO93bY,Bruno Mars,,"Bruno Mars, Anderson .Paak, Silk Sonic - Smokin Out The Window - Live from the American Music Awards 2021 ‘An Evening with Silk Sonic’ available now: https://SilkSonic.lnk.to/AEWSSID ..."
Taylor Swift ft. Chris Stapleton - I Bet You Think About Me (Taylor's Version) (Officia...,https://www.youtube.com/watch?v=5UMCrq-bBCg,Taylor Swift,,Red (Taylor’s Version) available everywhere now: https://taylor.lnk.to/redtaylorsversion ►Subscribe to Taylor Swift on YouTube: https://ts.lnk.to/subscribe ►Exclusive Merch: http://taylor...
That one McDonalds employee,https://www.youtube.com/watch?v=0X_wujZXwc4,snerixx,,
Most People Don't Know How Bikes Work,https://www.youtube.com/watch?v=9cNmUNHSBac,Veritasium,,"Why are bicycles stable? The most common answer is gyroscopic effects, but this is not right. This video was sponsored by Kiwico. Get 50% off your first month of any crate at https://kiwico.com/ver..."
EST Gee - Lamborghini Geeski (Official Music Video),https://www.youtube.com/watch?v=3fIJV2W5PhM,EST Gee,,Listen to EST Gee's “Lamborghini Geeski” available on all platforms: https://estgee.lnk.to/LamborghiniGeeski Follow EST Gee: https://twitter.com/ESTGEE https://www.instagram.com/est.gee...
Shaquille O'Neal Goes Sneaker Shopping With Complex,https://www.youtube.com/watch?v=VfOtgxp4Fng,Complex,,"Shaquille O’Neal goes Sneaker Shopping with Complex’s Joe La Puma at A Ma Maniere in Atlanta and talks about signing to Reebok, starting his own sneaker brand, and the problems he’s dealt..."
Can I Use The Customers Water When Pressure Washing?,https://www.youtube.com/watch?v=j66p1e8MyZk,Forever Self Employed,,
